Gyakorlat neve;Érintett izomcsoportok;Szükséges eszközök;Nehézségi szint;Leírás
Vádliemelés;Vádli;Nincs (saját testsúly);Kezdő;Álló helyzetben a lábujjak emelése, hogy a vádli izmokat dolgoztassa meg.
Vádliemelés egy lábon;Vádli;Nincs (saját testsúly);Kezdő;Egyik lábra helyezkedve a vádliból kitolás, a másik láb segítsége nélkül.
Lábtoló gép vádliemeléssel;Vádli, combizmok;Lábtoló gép;Középhaladó;A lábtoló gépen végezhető vádliemelés, amely erősíti a vádlikat.
Vádliemelés ülve;Vádli;Vádliemelő gép;Középhaladó;Ülő helyzetben a vádli emelése, az ülőpozíció maximális izomaktiválást biztosít.
Vádliemelés rúdon;Vádli;Rúd vagy súlyzók;Középhaladó;A vádli emelése, miközben egy rúddal a vállakon vagy a kezünkben súlyt tartunk.
Lépcsőzés;Vádli, combok, fenék;Lépcső, pad vagy emelő;Kezdő;Lépcsőzés, amely közvetlenül célozza meg a vádli izmokat, de a combokat is erősíti.